<!ELEMENT   edittagtypes (editor) >
<!ELEMENT   editor  (class,param*,info) >
<!ATTLIST   editor  type    CDATA   #REQUIRED> 
<!ELEMENT   class   (#PCDATA)>
<!ELEMENT   info    (#PCDATA)>
